Date,Title,Link,Source
2024-11-15 10:24:00,Applied Materials Shares Slide on Disappointing Sales Forecast,https://finance.yahoo.com/news/applied-materials-forecast-spurs-concern-222928709.html,Bloomberg
2024-11-14 16:36:00,Applied Materials' revenue forecast signals weak spending outside AI chips,https://finance.yahoo.com/news/applied-materials-forecasts-quarterly-revenue-213656967.html,Reuters
2024-11-14 16:36:00,Applied Materials forecasts quarterly revenue below estimates on weak demand,https://finance.yahoo.com/news/applied-materials-forecasts-quarterly-revenue-213656902.html,Reuters
2024-12-03 09:54:00,Applied Materials outlook unchanged after latest US crackdown on China chip exports,https://finance.yahoo.com/news/applied-materials-outlook-unchanged-latest-145430082.html,Reuters
2025-02-13 16:20:00,"Applied Materials Gives Tepid Forecast, Cites China Headwinds",https://finance.yahoo.com/news/applied-materials-gives-tepid-forecast-212000373.html,Bloomberg
2025-02-13 16:50:00,Applied Materials gives dour quarterly revenue forecast as export curbs tighten; shares fall,https://finance.yahoo.com/news/applied-materials-gives-dour-quarterly-215029391.html,Reuters
2025-02-13 17:12:00,"Applied Materials Gives Tepid Forecast, Cites China Rules",https://finance.yahoo.com/news/applied-materials-gives-tepid-forecast-212000252.html,Bloomberg
2025-02-14 09:46:00,Applied Materials Falls as Export Controls Weigh on Outlook,https://finance.yahoo.com/news/applied-materials-gives-tepid-forecast-212000252.html,Bloomberg
