Date,Title,Link,Source
2024-11-13 12:18:00,AMD to cut 4% of global workforce as it focuses on AI chip development,https://finance.yahoo.com/news/amd-cut-4-global-workforce-171829397.html,Reuters
2024-11-13 11:41:00,AMD Cutting About 4% of Workforce to Focus Resources on AI Push,https://finance.yahoo.com/news/amd-cutting-4-workforce-focus-164122776.html,Bloomberg
2024-12-03 13:13:00,"Intel Considers Outsiders for CEO, Including Marvells Head",https://finance.yahoo.com/news/intel-considers-outsiders-ceo-including-181350659.html,Bloomberg
2024-12-05 10:00:00,AMD CEO Lisa Su Is Ready for the AI Spotlight,https://finance.yahoo.com/news/amd-ceo-lisa-su-ready-150013139.html,Bloomberg
2024-12-13 13:47:00,Liquid AI closes $250 million early-stage funding round led by AMD,https://finance.yahoo.com/news/liquid-ai-closes-250-million-184700451.html,Reuters
2025-01-06 14:45:00,AMD Adds Dell as Commercial PC Customer for the First Time,https://finance.yahoo.com/news/amd-adds-dell-commercial-pc-194500333.html,Bloomberg
2025-01-06 18:11:00,Dollar Slump Offers Reprieve for Asian Currencies: Markets Wrap,https://finance.yahoo.com/news/dollar-slump-offers-reprieve-asian-231145607.html,Bloomberg
2025-01-08 22:09:00,Asian Stocks Dip as Traders Shift Focus to US Jobs: Markets Wrap,https://finance.yahoo.com/news/asian-stocks-set-cautious-open-222844546.html,Bloomberg
2025-01-09 16:12:00,Bond Traders See Jobs Testing Hawkish Fed Pricing: Markets Wrap,https://finance.yahoo.com/news/asian-stocks-set-cautious-open-222844546.html,Bloomberg
