Date,Title,Link,Source
2024-10-29 20:03:00,"OpenAI, Broadcom Working to Develop AI Inference Chip",https://finance.yahoo.com/news/openai-broadcom-working-develop-ai-222751131.html,Bloomberg
2024-10-29 13:15:00,Broadcom Gains on Report That Its Working With OpenAI,https://finance.yahoo.com/news/broadcom-gains-report-working-openai-171517408.html,Bloomberg
2024-10-29 12:42:00,"Exclusive-OpenAI builds first chip with Broadcom and TSMC, scales back foundry ambition",https://finance.yahoo.com/news/exclusive-openai-builds-first-chip-164225286.html,Reuters
2024-12-03 11:53:00,Intels CEO Departure Opens Door to Fresh Deal Discussions,https://finance.yahoo.com/news/intel-ceo-departure-opens-door-021652426.html,Bloomberg
2024-12-05 09:02:00,Broadcom unveils new tech to speed up custom chips amid rising GenAI demand,https://finance.yahoo.com/news/broadcom-unveils-tech-speed-custom-140241416.html,Reuters
2024-12-06 16:56:00,Apple Plans Three-Year Modem Rollout in Bid to Top Qualcomm,https://finance.yahoo.com/news/apple-prepares-three-modem-rollout-164412669.html,Bloomberg
2024-12-11 09:19:00,"Apple working with Broadcom to develop AI chip, the Information reports",https://finance.yahoo.com/news/apple-working-ai-chip-broadcom-141956432.html,Reuters
2024-12-12 14:47:00,"Apple nears switch to in-house Bluetooth and Wi-Fi chip for iPhone, smart home, Bloomberg reports",https://finance.yahoo.com/news/apple-nears-switch-house-bluetooth-194718770.html,Reuters
2024-12-12 16:23:00,Broadcom forecasts first-quarter revenue above estimates,https://ca.finance.yahoo.com/news/broadcom-forecasts-first-quarter-revenue-212324226.html,Reuters
2024-12-12 16:23:00,Broadcom forecasts first-quarter revenue above estimates on strong AI chip demand,https://finance.yahoo.com/news/broadcom-forecasts-first-quarter-revenue-212324609.html,Reuters
2024-12-12 18:31:00,Broadcom Shares Jump After Chipmaker Predicts AI Sales Surge,https://finance.yahoo.com/news/broadcom-shares-jump-chipmaker-predicts-233108061.html,Bloomberg
2024-12-12 19:35:00,Xiaomis 103% Rally Puts EV Dark Horse on Brink of Stock Record,https://finance.yahoo.com/news/xiaomi-103-rally-puts-ev-003521940.html,Bloomberg
2024-12-13 04:35:00,Xiaomis 101% Rally Puts EV Dark Horse on Brink of Stock Record,https://finance.yahoo.com/news/xiaomi-103-rally-puts-ev-003521940.html,Bloomberg
2024-12-13 06:00:00,Nasdaq futures lead gains after Broadcom's upbeat forecast,https://finance.yahoo.com/news/nasdaq-futures-lead-gains-broadcoms-110033390.html,Reuters
2024-12-13 06:00:00,Nasdaq futures lead advance after Broadcom's upbeat forecast,https://finance.yahoo.com/news/nasdaq-futures-lead-gains-broadcoms-110033548.html,Reuters
2024-12-13 06:24:00,Broadcom rallies on forecast for booming AI chip demand,https://finance.yahoo.com/news/broadcom-rallies-forecast-booming-ai-112453460.html,Reuters
2024-12-13 16:23:00,Broadcom Valuation Soars Past $1 Trillion on AI Sales Boom,https://finance.yahoo.com/news/broadcom-shares-jump-chipmaker-predicts-233108061.html,Bloomberg
2024-12-17 09:54:00,Broadcoms Nvidia Moment Has Arrived. Now It Needs to Deliver,https://finance.yahoo.com/news/broadcom-nvidia-moment-arrived-now-145444560.html,Bloomberg
2024-12-23 14:08:00,"Tesla, Meta and Broadcom Weights Shrink in Nasdaq 100 Rebalance",https://finance.yahoo.com/news/tesla-meta-broadcom-weights-shrink-190831294.html,Bloomberg
2025-01-06 16:15:00,Nvidia Investors Look to Huang CES Speech to Spark Next Breakout,https://finance.yahoo.com/news/nvidia-investors-look-huang-ces-105256704.html,Bloomberg
2025-02-03 07:12:00,AMD earnings: AI bets face investor scrutiny as Big Tech switches to custom chips,https://finance.yahoo.com/news/amds-ai-bets-face-investor-121202399.html,Reuters
2025-02-04 19:15:00,US Treasury Brings In Two Members From Musks DOGE Team,https://finance.yahoo.com/news/us-treasury-brings-two-members-171641951.html,Bloomberg
2025-02-07 09:38:00,AMDs Stock Slump Shows Theres No Silver Medal in AI,https://finance.yahoo.com/news/amd-stock-slump-shows-no-124554525.html,Bloomberg
2025-02-15 21:19:00,"Broadcom, TSMC eye possible Intel deals to split storied chipmaker, WSJ reports",https://ca.finance.yahoo.com/news/broadcom-tsmc-eye-possible-intel-021925207.html,Reuters
2025-02-18 16:12:00,Intel Has Biggest Rally Since 2020 on Breakup Speculation,https://finance.yahoo.com/news/intel-biggest-rally-since-2020-211245439.html,Bloomberg
2025-03-03 06:04:00,"Nvidia and Broadcom testing chips on Intel manufacturing process, sources say",https://finance.yahoo.com/news/exclusive-nvidia-broadcom-testing-chips-110442469.html,Reuters
2025-03-03 11:12:00,"Factbox-Intel's divisions in spotlight as TSMC, Broadcom circle",https://finance.yahoo.com/news/factbox-intels-divisions-spotlight-tsmc-161214634.html,Reuters
2025-03-06 16:24:00,Broadcom forecasts strong second quarter on upbeat AI chip demand,https://finance.yahoo.com/news/broadcom-forecasts-second-quarter-revenue-212446381.html,Reuters
2025-03-06 18:40:00,Broadcom Rallies After AI Growth Fuels Upbeat Sales Forecast,https://finance.yahoo.com/news/broadcom-rallies-ai-growth-fuels-234003847.html,Bloomberg
2025-03-07 05:39:00,Broadcom jumps as upbeat forecast quells AI chip demand worries,https://finance.yahoo.com/news/broadcom-jumps-upbeat-forecast-quells-103948109.html,Reuters
2025-03-07 09:38:00,Broadcom Shares Jump as AI Growth Fuels Upbeat Forecast,https://finance.yahoo.com/news/broadcom-rallies-ai-growth-fuels-234003847.html,Bloomberg
