Date,Title,Link,Source
2024-11-22 17:40:00,"Three BofA bankers in India leave amid probe into stock sale, source says",https://finance.yahoo.com/news/three-bofa-bankers-india-leave-224012144.html,Reuters
2024-11-22 11:48:00,BofA's private banking arm names new client advisers,https://finance.yahoo.com/news/bofas-private-banking-arm-names-164834360.html,Reuters
2024-11-22 04:09:00,"Goldman, Morgan Stanley, BofA Ask Buyers of Bank Risk to Disclose Leverage",https://finance.yahoo.com/news/goldman-morgan-stanley-bofa-ask-193014909.html,Bloomberg
2024-11-22 01:00:00,Three BofA India Bankers Leave Amid Probe on Stock Offerings,https://finance.yahoo.com/news/three-bofa-india-bankers-leave-060038539.html,Bloomberg
2024-11-21 14:27:00,"Three BofA bankers in India leave over alleged client tips, FT reports",https://finance.yahoo.com/news/three-bofa-bankers-india-leave-192748719.html,Reuters
2024-11-18 15:10:00,Brookfields BofA Tower in LA Sees 69% Decline in Appraised Value,https://finance.yahoo.com/news/brookfield-bofa-tower-la-sees-201027298.html,Bloomberg
2024-11-18 13:21:00,"Gold Jumps as Goldman Reasserts $3,000 Target for 2025",https://finance.yahoo.com/news/gold-rebounds-deep-weekly-loss-014240108.html,Bloomberg
2024-11-15 02:33:00,China Stimulus Boosts Domestic Consumption as Trump Tariffs Loom,https://finance.yahoo.com/news/china-economy-stabilizes-consumption-rises-020035548.html,Bloomberg
2024-11-12 14:18:00,BofA CEO urges Trump administration to tackle US budget,https://finance.yahoo.com/news/bofa-ceo-urges-trump-administration-191800102.html,Reuters
2024-11-08 12:56:00,"Trump Win Boosts Demand for Credit, With Spreads at 1998 Low",https://finance.yahoo.com/news/trump-win-boosts-demand-credit-162405300.html,Bloomberg
2024-11-04 15:54:00,"US banks encourage workers to vote, carving out paid time off",https://finance.yahoo.com/news/us-banks-encourage-workers-vote-205455912.html,Reuters
2024-10-30 04:15:00,Gold Demand Tops $100 Billion as Western Investors Charge In,https://finance.yahoo.com/news/world-gold-demand-tops-100-060000281.html,Bloomberg
2024-10-29 16:52:00,"Bank of America in talks with regulator to resolve Zelle probe, evaluates litigation",https://finance.yahoo.com/news/bofa-considers-suing-us-consumer-205213517.html,Reuters
2024-12-03 12:00:00,Blackstone Refinances Debt for Luxury NYC Condo Tower With Munis,https://finance.yahoo.com/news/blackstone-refinances-debt-luxury-nyc-170028738.html,Bloomberg
2024-12-03 15:27:00,"Oil Rises on Iran Crude Sanctions, OPEC+ Output Deal Progress",https://finance.yahoo.com/news/oil-stays-tight-range-opec-233654169.html,Bloomberg
2024-12-04 01:25:00,Bank of America Expands Debt-Swap Footprint With Ecuador Deal,https://finance.yahoo.com/news/bank-america-expands-debt-swap-200000403.html,Bloomberg
2024-12-04 08:12:00,Gold Steadies as Market Weighs Turmoil in South Korea and France,https://finance.yahoo.com/news/gold-settles-turmoil-korea-france-002158139.html,Bloomberg
2024-12-10 16:19:00,BofA Prices $1 Billion in New Bonds for Ecuador Swap,https://finance.yahoo.com/news/bofa-readies-sale-1-billion-175549506.html,Bloomberg
2024-12-10 17:09:00,Pound Closes at Eight-Year High Versus Euro on Split Rates Views,https://finance.yahoo.com/news/pound-hits-highest-versus-euro-110027236.html,Bloomberg
2024-12-11 06:57:00,Bank of America Taps Adviser for Potential London Office Move,https://finance.yahoo.com/news/bank-america-taps-adviser-potential-115711447.html,Bloomberg
2024-12-11 15:42:00,"Bank of America promotes 387 employees to managing director, source says",https://finance.yahoo.com/news/bank-america-promotes-387-employees-204241898.html,Reuters
2024-12-12 10:30:00,US Producer Prices Jump on Eggs But Fed Categories Come in Soft,https://finance.yahoo.com/news/us-producer-prices-jump-eggs-140137080.html,Bloomberg
2024-12-13 16:39:00,"Bank of America, Goldman to donate undecided amounts to Trump's inaugural committee",https://finance.yahoo.com/news/bank-america-says-donate-undecided-213913697.html,Reuters
2024-12-18 06:00:00,BofAs Moynihan Hints That Hes Just Getting Started 15 Years In,https://finance.yahoo.com/news/bofa-moynihan-hints-just-getting-110000486.html,Bloomberg
2024-12-27 08:35:00,HomeStreet Bank offloads $990 million multifamily loans to BofA in profit push,https://finance.yahoo.com/news/homestreet-bank-sell-990-million-133532573.html,Reuters
2024-12-31 18:03:00,"Citigroup, BofA join US lenders in exiting Net-Zero Banking Alliance",https://finance.yahoo.com/news/citigroup-bofa-join-us-lenders-230351489.html,Reuters
2025-01-06 15:14:00,Oil Falls as Technicals Signal Five-Session Rally Is Overdone,https://finance.yahoo.com/news/oil-holds-near-two-month-233007507.html,Bloomberg
2025-01-07 19:18:00,Wall Street Banks Cleared by Texas After Exiting Climate Group,https://finance.yahoo.com/news/wall-street-banks-cleared-texas-001809120.html,Bloomberg
2025-01-09 17:38:00,"Bank of America bonuses for investment bankers to rise about 10%, source says",https://finance.yahoo.com/news/bank-america-bonuses-investment-bankers-223845397.html,Reuters
2025-01-10 05:00:00,Oil Jumps to Three-Month High as Cold Snap Tightens Inventories,https://finance.yahoo.com/news/oil-extends-gains-falling-inventories-233053649.html,Bloomberg
2025-01-10 07:48:00,BofA consumer investments surpass $500 billion as it eyes $1 trillion,https://finance.yahoo.com/news/bofa-consumer-investments-surpass-500-124839997.html,Reuters
2025-01-13 13:16:00,Los Angeles Muni Utilitys Bond Sale Is in Limbo Amid Fires,https://finance.yahoo.com/news/los-angeles-muni-utility-bond-181608143.html,Bloomberg
