Date,Title,Link,Source
2024-11-26 07:06:00,Best Buy cuts annual forecasts on weak electronics demand during the holidays,https://finance.yahoo.com/news/best-buy-cuts-annual-profit-120625426.html,Reuters
2024-11-27 09:00:00,A Very ChatGPT Christmas: Savvy Black Friday Shoppers Use AI to Find Deals,https://finance.yahoo.com/news/very-chatgpt-christmas-savvy-black-140002565.html,Bloomberg
2024-12-05 11:04:00,A Very ChatGPT Christmas: Savvy Black Friday Shoppers Use AI to Find Deals,https://finance.yahoo.com/news/very-chatgpt-christmas-savvy-black-140002565.html,Bloomberg
2025-03-04 07:13:00,Best Buy warns of potential price increases as fresh US tariffs roll in,https://finance.yahoo.com/news/best-buy-posts-surprise-rise-121352697.html,Reuters
2025-03-04 14:09:00,US Retailers Warn Consumers of Tariff Woes,https://finance.yahoo.com/video/us-retailers-warn-consumers-tariff-190920378.html,Bloomberg
