Date,Title,Link,Source
2024-10-03 23:19:00,Berkshire Sounds Out Market for Yen Bonds as Yields Slide,https://finance.yahoo.com/news/berkshire-sounds-market-yen-bonds-014002134.html,Bloomberg
2024-10-03 09:06:00,Berkshire unloads more Bank of America shares,https://finance.yahoo.com/news/berkshire-unloads-more-bank-america-130640627.html,Reuters
2024-10-01 09:45:00,Berkshire Hathaway buys full control of its energy unit,https://finance.yahoo.com/news/berkshire-hathaway-buys-full-control-134514675.html,Reuters
2024-10-01 00:02:00,Berkshire Plans New Yen Bond Sale in Boost to Trading Houses,https://finance.yahoo.com/news/berkshire-plans-yen-bond-sale-022353511.html,Bloomberg
2025-01-07 11:46:00,Berkshire shareholder seeks committee to oversee AI at Buffett's company,https://finance.yahoo.com/news/berkshire-shareholder-seeks-committee-oversee-164618828.html,Reuters
