Date,Title,Link,Source
2024-11-14 16:19:00,Canadas Infrastructure Keeps Aging as Investment Fails to Keep Up,https://finance.yahoo.com/news/canada-infrastructure-keeps-aging-investment-211950599.html,Bloomberg
2024-11-10 09:00:00,"With Trump Win Boosting Stocks, Investors Hunt for Next Winners",https://finance.yahoo.com/news/trump-win-boosting-stocks-investors-140000688.html,Bloomberg
2024-10-30 11:19:00,Caterpillar Slides as Machinery Maker Curbs Full-Year Outlook,https://finance.yahoo.com/news/caterpillar-misses-estimates-weakening-construction-104307135.html,Bloomberg
2024-10-30 06:38:00,"Caterpillar cuts annual sales forecast on slowing demand, shares fall",https://finance.yahoo.com/news/caterpillar-posts-lower-adjusted-quarterly-103851597.html,Reuters
2024-10-14 19:25:00,Asian Stocks Poised to Track US Gains; Oil Drops: Markets Wrap,https://finance.yahoo.com/news/asian-stocks-poised-track-us-222613970.html,Bloomberg
2025-01-30 06:35:00,Caterpillar warns of sales drop in 2025 on weak equipment demand,https://finance.yahoo.com/news/caterpillar-quarterly-profit-falls-tepid-113526714.html,Reuters
2025-01-30 09:41:00,Caterpillar Shares Fall Most in 3 Months on Lower Sales Outlook,https://finance.yahoo.com/news/caterpillar-warns-lower-revenues-earnings-114632985.html,Bloomberg
2025-01-30 15:35:00,Caterpillar Falls on Weak Revenue Forecast,https://finance.yahoo.com/video/caterpillar-falls-weak-revenue-forecast-203539780.html,Bloomberg
