Date,Title,Link,Source
2024-11-20 08:51:00,"Comcast to Spin Off Cable Channels MSNBC, USA",https://finance.yahoo.com/news/comcast-spin-off-cable-channels-135111826.html,Bloomberg
2024-11-20 08:09:00,Comcast to spin off some cable TV networks as streaming dominates,https://finance.yahoo.com/news/comcast-moves-ahead-cable-network-130929757.html,Reuters
2024-11-20 05:55:00,"Comcast to spin off cable-TV channels like MSNBC, USA",https://finance.yahoo.com/news/comcast-spin-off-cable-tv-000317424.html,Bloomberg
2024-11-19 20:25:00,"Comcast to proceed with plans to spin off its cable channels, sources say",https://finance.yahoo.com/news/comcast-proceed-plans-spin-off-012526282.html,Reuters
2024-11-15 11:45:00,Disney Targets $1 Billion in Streaming Profit in Fiscal 2025,https://finance.yahoo.com/news/disney-targets-1-billion-streaming-110000973.html,Bloomberg
2024-11-05 17:29:00,Paramount Gave Up on Warner Bros. Merger After Months of Talks,https://finance.yahoo.com/news/paramount-gave-warner-bros-merger-222950515.html,Bloomberg
2024-11-01 10:24:00,Charter Stems Broadband Losses After Subsidy End; Shares Surge,https://finance.yahoo.com/news/charter-stems-broadband-losses-subsidy-142454275.html,Bloomberg
2024-12-09 08:58:00,"Comcast, Warner Bros Discovery enter multi-year distribution deal",https://finance.yahoo.com/news/comcast-warner-bros-discovery-enter-135816297.html,Reuters
2024-12-09 10:26:00,"Comcast warns of higher broadband losses on tough competition, hurricane hit",https://finance.yahoo.com/news/comcast-expects-broadband-subscriber-losses-152655450.html,Reuters
2025-01-07 09:22:00,"Paramount, Comcast renew multi-year carriage deal",https://finance.yahoo.com/news/paramount-comcast-renew-multi-carriage-142230321.html,Reuters
2025-01-13 11:29:00,"Comcast to Buy Minority Stake in 76ers, Join New-Stadium Venture",https://finance.yahoo.com/news/comcast-buy-minority-stake-76ers-162951264.html,Bloomberg
