Date,Title,Link,Source
2024-10-30 19:22:00,Cognizant beats quarterly profit estimates on gradual recovery in IT services demand,https://finance.yahoo.com/news/cognizant-beats-quarterly-profit-estimates-232202131.html,Reuters
2024-07-31 16:40:00,"Cognizant raises full year revenue forecast, beats Q2 results estimates",https://finance.yahoo.com/news/cognizant-raises-full-revenue-forecast-204009446.html,Reuters
2024-05-01 18:07:00,Cognizant first-quarter revenue beats estimates on steady spending by clients,https://finance.yahoo.com/news/cognizant-first-quarter-revenue-beats-220739628.html,Reuters
2025-02-05 18:23:00,Cognizant forecasts 2025 revenue below estimates as businesses temper IT spending,https://finance.yahoo.com/news/cognizant-forecasts-2025-revenue-below-232321811.html,Reuters
2025-03-07 16:48:00,"Activist investor Mantle Ridge builds a more than $1 billion stake in Cognizant, WSJ reports",https://finance.yahoo.com/news/activist-investor-mantle-ridge-builds-214852619.html,Reuters
2025-03-07 19:42:00,Mantle Ridge Said to Build $1 Billion-Plus Cognizant Stake,https://finance.yahoo.com/news/cognizant-rises-report-activist-mantle-222310533.html,Bloomberg
