Date,Title,Link,Source
2024-11-18 17:22:00,Corteva Unveils Wheat Breakthrough as Seed Race Heats Up,https://finance.yahoo.com/news/corteva-unveils-hybrid-wheat-breakthrough-165323570.html,Bloomberg
2024-11-07 10:20:00,Seed Company Corteva Plunges as Profit Outlook Dims on Crop Woes,https://finance.yahoo.com/news/seed-company-corteva-plunges-profit-152048690.html,Bloomberg
2024-11-06 16:24:00,"Corteva reports larger-than-expected loss, cuts full-year sales outlook",https://finance.yahoo.com/news/corteva-misses-quarterly-estimates-212456877.html,Reuters
2024-07-31 16:23:00,Corteva trims 2024 forecasts on pricing pressure in crop protection,https://finance.yahoo.com/news/corteva-beats-quarterly-profit-estimates-202353670.html,Reuters
2024-07-22 06:00:00,American Farmers Next Hot Commodity Is Canola for Biofuels,https://finance.yahoo.com/news/american-farmers-next-hot-commodity-100023491.html,Bloomberg
2024-05-01 17:19:00,UPDATE 2-Corteva beats estimates for quarterly profit on strong seed sales,https://finance.yahoo.com/news/1-corteva-beats-estimates-quarterly-211912047.html,Reuters
2024-05-01 17:12:00,Corteva beats estimates for quarterly profit,https://finance.yahoo.com/news/corteva-beats-estimates-quarterly-profit-211236980.html,Reuters
2024-12-05 17:15:00,Corteva Eyes Brazil to Boost Sales of US-Dominating Soybeans,https://finance.yahoo.com/news/corteva-ceo-wants-replicate-us-223450083.html,Bloomberg
2025-02-05 16:38:00,"Corteva reports smaller fourth-quarter loss, shares slip on 2025 profit forecast",https://finance.yahoo.com/news/corteva-reports-smaller-fourth-quarter-213823822.html,Reuters
