Date,Title,Link,Source
2024-11-18 12:10:00,CVS Adds Glenviews Robbins to Board Under Activist Pressure,https://finance.yahoo.com/news/cvs-adds-glenview-robbins-board-171039185.html,Bloomberg
2024-11-18 06:42:00,CVS adds four new board members in deal with Glenview as CEO pursues a turnaround,https://finance.yahoo.com/news/cvs-adds-four-board-members-114216436.html,Reuters
2024-11-14 18:23:00,"Glenview, Sachem Head, Third Point buy CVS shares during Q3-filings",https://finance.yahoo.com/news/glenview-sachem-head-third-point-232351004.html,Reuters
2024-11-06 12:54:00,"CVS Taps Ex-UnitedHealth Executive for Aetna, Skips Guidance",https://finance.yahoo.com/news/cvs-taps-ex-unitedhealth-executive-144600016.html,Bloomberg
2024-11-06 06:37:00,CVS taps former UnitedHealth executive to run Aetna insurance unit,https://finance.yahoo.com/news/cvs-taps-former-unitedhealth-executive-113736824.html,Reuters
2024-11-05 06:06:00,Wall Street looking for CVS to show execution plan,https://finance.yahoo.com/news/wall-street-looking-cvs-show-110628603.html,Reuters
2024-10-31 14:52:00,Pennsylvania man charged with insider trading related to CVS takeover,https://finance.yahoo.com/news/pennsylvania-man-charged-insider-trading-185210159.html,Reuters
2024-10-31 13:37:00,CVS Credit Rating at Risk After Growth Gamble Fails to Pay Off,https://finance.yahoo.com/news/cvs-credit-rating-risk-growth-173712801.html,Bloomberg
2024-10-22 14:05:00,"More US firms lean on retired, veteran leaders to steady ship in choppy economy",https://finance.yahoo.com/news/more-us-firms-lean-retired-180552730.html,Reuters
2024-10-21 06:03:00,Analysis-Can the new CVS CEO handle the Aetna challenge?,https://finance.yahoo.com/news/analysis-cvs-ceo-handle-aetna-100333239.html,Reuters
2024-12-02 17:24:00,CVS Eyes Up to $2.5 Billion Bond Sale as It Buys Back Debt,https://finance.yahoo.com/news/cvs-eyes-2-5-billion-222415498.html,Bloomberg
2024-12-11 11:54:00,Lawmakers Eye Bill Forcing Drug Middlemen to Sell Pharmacies,https://finance.yahoo.com/news/lawmakers-eye-bill-forcing-drug-145619369.html,Bloomberg
2024-12-16 15:44:00,Insurer stocks fall after Trump says 'we're going to knock out the middleman',https://finance.yahoo.com/news/insurer-stocks-fall-trump-says-204428571.html,Reuters
2024-12-19 12:43:00,Hybrid Bonds Are Getting Hot in US After Moodys Made Key Switch,https://finance.yahoo.com/news/hybrid-bonds-getting-hot-us-174316558.html,Bloomberg
2025-01-10 18:30:00,US proposes payment rate for 2026 Medicare Advantage insurers,https://finance.yahoo.com/news/us-proposes-payment-rate-2026-233023449.html,Reuters
