Date,Title,Link,Source
2024-06-05 06:28:00,Deere announces job cuts to tackle slowing farm equipment demand,https://finance.yahoo.com/news/deere-announces-job-cuts-tackle-102824619.html,Reuters
2024-05-31 18:00:00,Deere to Dismiss Some Salaried Workers Amid Farm Downturn,https://finance.yahoo.com/news/deere-dismiss-salaried-workers-amid-220046943.html,Bloomberg
2025-01-06 13:30:00,Deere Goes Driverless Beyond Midwest Farms to Ease Labor Crunch,https://finance.yahoo.com/news/deere-goes-driverless-beyond-midwest-183000913.html,Bloomberg
2025-01-06 13:32:00,Deere boosts bet on autonomous tractors with new machines,https://finance.yahoo.com/news/deere-boosts-bet-autonomous-tractors-183220154.html,Reuters
2025-02-13 06:14:00,Deere misses revenue estimates on subdued farm equipment demand,https://finance.yahoo.com/news/deere-reports-lower-profit-muted-111408723.html,Reuters
2025-02-13 12:25:00,Deere Sees Improvement in Farm Economy Though Tariffs Loom,https://finance.yahoo.com/news/deere-shares-ease-maintains-outlook-111559935.html,Bloomberg
2025-02-13 15:00:00,Deere Hints at Turnaround Despite Slump in Farm Market,https://finance.yahoo.com/video/deere-hints-turnaround-despite-slump-200031844.html,Bloomberg
2025-02-26 13:38:00,Investors in farm equipment maker Deere reject anti-DEI resolution,https://finance.yahoo.com/news/investors-farm-equipment-maker-deere-183834465.html,Reuters
