Date,Title,Link,Source
2024-11-22 16:05:00,Super Micro Investors Whiplashed as Tech Firm Fights for Listing,https://finance.yahoo.com/news/super-micro-investors-whiplashed-tech-140852225.html,Bloomberg
2024-11-19 16:23:00,"Dell, Iron Bow settle charges they overcharged the Army, DOJ says",https://finance.yahoo.com/news/dell-iron-bow-settle-charges-212327363.html,Reuters
2024-11-26 18:24:00,"Dell, HP Inc. Report Disappointing Sales on Slower PC Market",https://finance.yahoo.com/news/dell-reports-sales-miss-estimates-210925855.html,Bloomberg
2024-11-26 16:08:00,Dell's third-quarter revenue misses on PC weakness,https://finance.yahoo.com/news/dells-third-quarter-revenue-misses-210846329.html,Reuters
2024-11-27 07:07:00,"HP, Dell's weak forecasts spark share selloff, doubts over PC market recovery",https://finance.yahoo.com/news/hp-dells-weak-forecasts-spark-120706184.html,Reuters
2024-11-27 16:06:00,Dell and HP Inc. Fall After Reporting Disappointing PC Sales,https://finance.yahoo.com/news/dell-reports-sales-miss-estimates-210925855.html,Bloomberg
2024-12-05 13:50:00,Dell Deploys Tens of Thousands of Chips for AI at Musks Memphis Supercomputer,https://finance.yahoo.com/news/dell-deploys-tens-thousands-chips-185009090.html,Bloomberg
2025-01-06 14:45:00,Dell Unveils Apple-Like Rebrand in Bid to Make PCs Cool Again,https://finance.yahoo.com/news/dell-unveils-apple-rebrand-bid-194500030.html,Bloomberg
2025-01-06 14:45:00,AMD Adds Dell as Commercial PC Customer for the First Time,https://finance.yahoo.com/news/amd-adds-dell-commercial-pc-194500333.html,Bloomberg
2025-01-06 18:11:00,Dollar Slump Offers Reprieve for Asian Currencies: Markets Wrap,https://finance.yahoo.com/news/dollar-slump-offers-reprieve-asian-231145607.html,Bloomberg
2025-01-10 16:18:00,HPE Wins $1 Billion AI Server Deal for Elon Musks X,https://finance.yahoo.com/news/hpe-wins-1-billion-ai-195932953.html,Bloomberg
