Date,Title,Link,Source
2024-10-30 18:56:00,Equinix forecasts quarterly revenue above estimates on steady demand,https://finance.yahoo.com/news/equinix-forecasts-quarterly-revenue-above-225625263.html,Reuters
2024-10-01 09:41:00,Equinix signs $15 billion joint venture to build U.S. data center infrastructure,https://finance.yahoo.com/news/equinix-signs-15-billion-joint-134144111.html,Reuters
2024-08-07 17:41:00,Equinix raises annual adjusted core earnings forecast on strong data center demand,https://finance.yahoo.com/news/equinix-raises-annual-adjusted-core-214155360.html,Reuters
2024-07-22 23:19:00,"Data center firm Equinix enters the Philippines, eyes on Southeast Asia",https://finance.yahoo.com/news/data-center-firm-equinix-enters-031920407.html,Reuters
2025-02-12 16:56:00,"Equinix forecasts quarterly, annual revenue below estimates as strong dollar weighs",https://finance.yahoo.com/news/equinix-forecasts-quarterly-annual-revenue-215642328.html,Reuters
