Date,Title,Link,Source
2024-11-15 11:21:00,Analysis-Elliott's $5 billion Honeywell gambit: would a split pay off?,https://finance.yahoo.com/news/analysis-elliotts-5-billion-honeywell-162147885.html,Reuters
2024-11-13 12:34:00,US Stock Selldowns Ramp Up as Election Results Fuel Market Rally,https://finance.yahoo.com/news/us-stock-selldowns-ramp-election-173415729.html,Bloomberg
2024-09-27 07:35:00,Quarter-Trillion Dollars of Breakups Drive Dealmaking Recovery,https://finance.yahoo.com/news/quarter-trillion-dollars-breakups-drive-113557884.html,Bloomberg
2024-11-26 10:33:00,GE reaches $362.5 million shareholder settlement over power unit,https://finance.yahoo.com/news/ge-reaches-362-5-million-153313868.html,Reuters
2024-12-10 16:43:00,GE Vernova cautious about wind sector as gas business soars,https://finance.yahoo.com/news/ge-vernova-cautious-wind-sector-214301968.html,Reuters
2024-12-12 10:00:00,GE Vernova Expects More Trouble for Struggling Offshore Wind Industry,https://finance.yahoo.com/news/ge-vernova-expects-more-trouble-150000605.html,Bloomberg
