Date,Title,Link,Source
2024-11-19 09:42:00,Lowes Sales Squeezed as Shoppers Postpone Big Home Projects,https://finance.yahoo.com/news/lowe-sales-squeezed-shoppers-postpone-130407219.html,Bloomberg
2024-11-12 09:45:00,Home Depot Raises Outlook on Hurricane-Fueled Demand,https://finance.yahoo.com/news/home-depot-raises-outlook-bad-110118362.html,Bloomberg
2024-11-12 06:06:00,Home Depot forecasts smaller drop in sales as hurricane demand boosts quarter,https://finance.yahoo.com/news/home-depot-raises-annual-same-110654297.html,Reuters
2025-02-25 06:06:00,Home Depot forecasts weak annual sales growth as demand wavers,https://finance.yahoo.com/news/home-depot-forecasts-annual-same-110623902.html,Reuters
2025-02-25 10:18:00,"Home Depot Sees Key Sales Metric Turning Positive, Lifting Stock",https://finance.yahoo.com/news/home-depot-sees-key-sales-151859542.html,Bloomberg
2025-02-26 09:34:00,Lowes Expects to Reverse Sales Slump on Improving Demand,https://finance.yahoo.com/news/lowe-expects-reverse-sales-slump-143427557.html,Bloomberg
