Date,Title,Link,Source
2024-11-22 06:59:00,"US probes JPMorgan's links with Iranian oil trader's hedge fund, Bloomberg News reports",https://finance.yahoo.com/news/us-probes-jpmorgans-links-iranian-115903197.html,Reuters
2024-11-22 06:02:00,US Probes JPMorgans Ties to Iranian Oil Kingpins Hedge Fund,https://finance.yahoo.com/news/us-probes-jpmorgan-ties-iranian-110255422.html,Bloomberg
2024-11-19 10:40:00,A Nudge From JPMorgan Drove Probe of Staleys Epstein Links,https://finance.yahoo.com/news/nudge-jpmorgan-spurred-uk-probe-022046673.html,Bloomberg
2024-11-18 17:46:00,"Trump Team Weighs Pairing Warsh at Treasury, Bessent on NEC",https://finance.yahoo.com/news/trump-team-shows-support-warsh-154549364.html,Bloomberg
2024-11-15 17:51:00,JPMorgan Upgraded by S&P After Decade of Market-Share Gains,https://finance.yahoo.com/news/jpmorgan-upgraded-p-decade-market-222329331.html,Bloomberg
2024-11-15 09:32:00,"Exclusive-JPMorgan weighs London HQ options as it outgrows Canary Wharf tower, sources say",https://finance.yahoo.com/news/exclusive-jpmorgan-weighs-london-hq-143230396.html,Reuters
2024-11-14 17:03:00,Traders Trim Bets for December Fed Rate Cut on Powells Caution,https://finance.yahoo.com/news/traders-trim-bets-december-fed-202541209.html,Bloomberg
2024-11-14 06:10:00,JPMorgan Sets Up Derivatives Development Unit in New India Hub,https://finance.yahoo.com/news/jpmorgan-sets-derivatives-development-unit-111058359.html,Bloomberg
2024-11-13 13:04:00,Klarna Readies US IPO With Valuation Recovering From Plunge,https://finance.yahoo.com/news/swedish-fintech-klarna-files-widely-060653270.html,Bloomberg
2024-11-08 12:56:00,"Trump Win Boosts Demand for Credit, With Spreads at 1998 Low",https://finance.yahoo.com/news/trump-win-boosts-demand-credit-162405300.html,Bloomberg
2024-11-06 09:53:00,"JPMorgan CEO Dimon to remain at bank and has no plans to join Trump administration, source says",https://ca.finance.yahoo.com/news/exclusive-jpmorgan-ceo-dimon-remain-145334085.html,Reuters
2024-11-06 05:54:00,Dollar Hits One-Year High as Trump Clinches Election Victory,https://finance.yahoo.com/news/dollar-rises-highest-since-july-024503941.html,Bloomberg
2024-11-04 21:09:00,"CoreWeave Picks Morgan Stanley, Goldman, JPMorgan for IPO",https://finance.yahoo.com/news/coreweave-picks-morgan-stanley-goldman-010838242.html,Bloomberg
2024-10-31 19:24:00,JPMorgan Pays $151 Million to Settle Slate of SEC Complaints,https://finance.yahoo.com/news/jpmorgan-pay-151-million-settle-214505584.html,Bloomberg
2024-11-26 15:05:00,Deutsche Bank Sees Bank Stock Rally Adding to Repo Market Strain,https://finance.yahoo.com/news/deutsche-bank-sees-bank-stock-200509086.html,Bloomberg
2024-11-26 12:44:00,"Wall Street banks get a lift from trading Israeli currency, bonds",https://finance.yahoo.com/news/wall-street-banks-lift-trading-174418333.html,Reuters
2024-11-29 12:37:00,Gold Extends Gains on Weaker Dollar and Rising Risks in Ukraine,https://finance.yahoo.com/news/gold-steady-fed-rate-path-002953417.html,Bloomberg
2024-11-29 21:48:00,JPMorgan agrees to drop lawsuit against Tesla over stock warrants,https://finance.yahoo.com/news/jpmorgan-agrees-drop-lawsuit-against-024805864.html,Reuters
2024-11-30 10:12:00,"JPMorgan Drops Suit Against Tesla Over Musk Tweet, Warrants",https://finance.yahoo.com/news/jpmorgan-drops-suit-against-tesla-002308194.html,Bloomberg
2024-12-01 22:17:00,Singapore cenbank fines JPMorgan $1.8 million over misconduct by relationship managers,https://finance.yahoo.com/news/singapore-cenbank-fines-jpmorgan-1-031703916.html,Reuters
2024-12-01 22:52:00,JPMorgan Fined $1.8 Million in Singapore Over Client Bond Trades,https://finance.yahoo.com/news/singapore-fines-jpmorgan-misconduct-over-035236959.html,Bloomberg
2024-12-02 06:06:00,JPMorgan Rejects Transition-Finance Trend Gripping Wall Street,https://finance.yahoo.com/news/jpmorgan-rejects-transition-finance-trend-130000658.html,Bloomberg
2024-12-02 14:20:00,"JPMorgan's investment banking chair departs, memo says",https://finance.yahoo.com/news/jpmorgans-investment-banking-chair-departs-192016819.html,Reuters
2024-12-04 08:12:00,Gold Steadies as Market Weighs Turmoil in South Korea and France,https://finance.yahoo.com/news/gold-settles-turmoil-korea-france-002158139.html,Bloomberg
2024-12-04 16:18:00,Fontainebleau Miami Beach to Borrow $975 Million in Bond Market,https://finance.yahoo.com/news/fontainebleau-miami-beach-borrow-975-211839617.html,Bloomberg
2024-12-09 04:36:00,GIC Picks JPMorgan to Advise on $5 Billion Greenko Stake Sale,https://finance.yahoo.com/news/gic-picks-jpmorgan-advise-5-093606947.html,Bloomberg
2024-12-09 23:48:00,GIC Picks JPMorgan to Help on $5 Billion Greenko Stake Sale,https://finance.yahoo.com/news/gic-picks-jpmorgan-advise-5-093606947.html,Bloomberg
2024-12-12 16:58:00,US banking giant JPMorgan elects Hershey CEO Michele Buck to board,https://finance.yahoo.com/news/us-banking-giant-jpmorgan-elects-215849985.html,Reuters
2024-12-12 19:59:00,Cantor Fitzgerald Pays SEC $6.75 Million for Alleged SPAC Abuses,https://finance.yahoo.com/news/cantor-fitzgerald-pays-sec-6-231437036.html,Bloomberg
2024-12-13 09:05:00,Tech Start-Up Databricks Seeks $2.5 Billion Private Debt Financing,https://finance.yahoo.com/news/tech-start-databricks-seeks-2-140500737.html,Bloomberg
2024-12-13 16:39:00,"Bank of America, Goldman to donate undecided amounts to Trump's inaugural committee",https://finance.yahoo.com/news/bank-america-says-donate-undecided-213913697.html,Reuters
2024-12-16 08:03:00,"Wall Street eyes 2025 volatility spikes on Trump tariffs, geopolitics",https://finance.yahoo.com/news/wall-street-eyes-2025-volatility-050000417.html,Bloomberg
2024-12-22 17:19:00,JPMorgan exits Australia's Star Entertainment,https://finance.yahoo.com/news/jpmorgan-exits-australias-star-entertainment-221909554.html,Reuters
2024-12-27 17:44:00,Yellen Says Treasury to Hit New Debt Limit in Mid-January,https://finance.yahoo.com/news/yellen-says-treasury-hit-debt-215149483.html,Bloomberg
2024-12-31 12:56:00,Chery Adds JPMorgan for $1 Billion Hong Kong Listing,https://finance.yahoo.com/news/chery-adds-jpmorgan-1-billion-055640054.html,Bloomberg
2025-01-07 11:26:00,JPMorgan Shakes Up CLO Group After Banking Trio Left for SMBC,https://finance.yahoo.com/news/jpmorgan-shakes-clo-group-banking-162622647.html,Bloomberg
2025-01-07 14:55:00,JPMorgan Sounds Out Investors for Everton FC Stadium Financing,https://finance.yahoo.com/news/jpmorgan-sounds-investors-everton-fc-163948008.html,Bloomberg
2025-01-07 19:18:00,Wall Street Banks Cleared by Texas After Exiting Climate Group,https://finance.yahoo.com/news/wall-street-banks-cleared-texas-001809120.html,Bloomberg
2025-01-09 15:34:00,Oil Advances as Dwindling Inventories Counter China Weakness,https://finance.yahoo.com/news/oil-steadies-volatile-session-signs-232806642.html,Bloomberg
2025-01-10 05:00:00,Oil Jumps to Three-Month High as Cold Snap Tightens Inventories,https://finance.yahoo.com/news/oil-extends-gains-falling-inventories-233053649.html,Bloomberg
2025-01-10 10:10:00,"JPMorgan asks staff to return to office five days a week, prompting complaints",https://ca.finance.yahoo.com/news/jpmorgan-asks-staff-return-office-151008200.html,Reuters
2025-01-12 23:34:00,CATL Poised to Pick Banks for $5 Billion HK Share Sale,https://finance.yahoo.com/news/catl-poised-pick-banks-5-043440145.html,Bloomberg
2025-01-13 11:33:00,Biggest US banks ready mortgage relief for victims of Los Angeles wildfires,https://finance.yahoo.com/news/jpmorgan-providing-forbearance-mortgage-customers-163330154.html,Reuters
2025-01-13 15:50:00,Treasuries Selloff Ripples Through World Markets After Jobs Data,https://finance.yahoo.com/news/treasuries-selloff-ripples-world-markets-104622891.html,Bloomberg
2025-01-13 16:48:00,"Databricks Inks $5 Billion of Private Credit, Bank Funding",https://finance.yahoo.com/news/databricks-inks-5-billion-financing-192045866.html,Bloomberg
2025-01-22 05:32:00,Top JPMorgan Bankers Message for European Rivals: Get Bigger,https://finance.yahoo.com/news/top-jpmorgan-banker-message-european-103204596.html,Bloomberg
2025-01-23 15:08:00,Oil Declines After Trump Says Hell Push OPEC to Lower Prices,https://finance.yahoo.com/news/oil-extends-drop-focus-rising-233531271.html,Bloomberg
2025-01-24 11:54:00,JPMorgan Investment Banker Willsey to Retire After Three Decades,https://finance.yahoo.com/news/jpmorgan-investment-banker-willsey-retire-165417886.html,Bloomberg
2025-01-27 02:30:00,JPMorgan Names India Investment Bank Leaders as Wadhwani Leaves,https://finance.yahoo.com/news/jpmorgan-names-india-investment-bank-073003716.html,Bloomberg
2025-01-28 06:10:00,JPMorgan in Talks to Rent Credit Suisses Former Canary Wharf HQ,https://finance.yahoo.com/news/jpmorgan-talks-rent-credit-suisse-111031831.html,Bloomberg
2025-01-28 07:09:00,JPMorgan picks Reed to run government and healthcare businesses,https://finance.yahoo.com/news/jpmorgan-picks-reed-run-government-120917715.html,Reuters
2025-01-28 08:21:00,"JPMorgan eyes space at former Credit Suisse tower in Canary Wharf, source says",https://finance.yahoo.com/news/jpmorgan-eyes-space-former-credit-132102125.html,Reuters
2025-01-28 20:30:00,Global Euphoria for Indian Bonds Wanes as Rupee Slumps,https://finance.yahoo.com/news/global-euphoria-indian-bonds-wanes-013023352.html,Bloomberg
2025-01-30 13:14:00,"Blackstone in talks to buy stake in New York City office building, sources say",https://finance.yahoo.com/news/blackstone-talks-buy-stake-york-181455149.html,Reuters
2025-01-31 06:30:00,JPMorgans Preferred Stock Sale Fuels Frenzied Hunt for Coupons,https://finance.yahoo.com/news/jpmorgan-preferred-stock-sale-fuels-113000791.html,Bloomberg
2025-01-31 10:57:00,JPMorgan names Thakur sole head of global markets unit as Sippel departs,https://finance.yahoo.com/news/jpmorgan-names-thakur-sole-head-155722266.html,Reuters
2025-01-31 11:37:00,"JPMorgans Sippel Exits for Rokos, Thakur Made Markets Chief",https://finance.yahoo.com/news/jpmorgan-sippel-exits-rokos-thakur-151525711.html,Bloomberg
2025-01-31 17:44:00,JPMorgan Plans $4 Billion US Gold Delivery Amid Tariff Fears,https://finance.yahoo.com/news/jpmorgan-plans-4-billion-gold-181226432.html,Bloomberg
2025-02-02 21:04:00,JPMorgan Plans $4 Billion US Gold Delivery Amid Tariff Fears,https://finance.yahoo.com/news/jpmorgan-plans-4-billion-gold-181226432.html,Bloomberg
2025-02-03 08:58:00,Kolanovic Returns With Prediction for An S&P 500 Downturn,https://finance.yahoo.com/news/kolanovic-returns-prediction-pullback-p-110001649.html,Bloomberg
2025-02-04 01:05:00,"Citi sticks to hybrid working, bucks return-to-office trend, FT reports",https://finance.yahoo.com/news/citi-sticks-hybrid-working-bucks-060548585.html,Reuters
2025-02-04 12:24:00,"JPMorgan hires rival Goldman executive for its business services unit, memo says",https://finance.yahoo.com/news/jpmorgan-hires-rival-goldmans-executive-172423393.html,Reuters
2025-02-05 12:32:00,"Getty Images Needed $1 Billion of Cash ASAP, So JPMorgan Got Creative",https://finance.yahoo.com/news/getty-images-needs-1-billion-173209817.html,Bloomberg
2025-02-05 15:17:00,Oil Falls to Lowest Settlement Price of 2025 as Traders Flee,https://finance.yahoo.com/news/oil-holds-drop-trade-war-233321705.html,Bloomberg
2025-02-05 16:28:00,"Ategrity Specialty Insurance Taps JPMorgan, Barclays for US IPO",https://finance.yahoo.com/news/ategrity-specialty-insurance-taps-jpmorgan-212850447.html,Bloomberg
2025-02-07 14:02:00,JPMorgan appoints co-heads of commercial banking Sable and Smith,https://finance.yahoo.com/news/jpmorgan-appoints-co-heads-commercial-190225486.html,Reuters
2025-02-09 21:19:00,Dollar Advances on Trumps Steel Comment as Trade Jitters Deepen,https://finance.yahoo.com/news/dollar-advances-trump-steel-trade-230829568.html,Bloomberg
2025-02-10 11:42:00,Dollar Adds to Gains as Trump Amps Up Rhetoric on Trade,https://finance.yahoo.com/news/dollar-advances-trump-steel-trade-230829568.html,Bloomberg
2025-02-12 09:15:00,Trump Calls for Lower Interest Rates as Powell Heads to Hill,https://finance.yahoo.com/news/trump-calls-lowering-interest-rates-133420516.html,Bloomberg
2025-02-12 11:34:00,"JPMorgan Chase begins planned layoffs for 2025, source says",https://finance.yahoo.com/news/jpmorgan-chase-begins-layoffs-more-163424331.html,Reuters
2025-02-12 20:42:00,"Exclusive-JPMorgan CEO Dimon derides in-office work pushback, demands efficiency",https://finance.yahoo.com/news/exclusive-jpmorgan-ceo-dimon-derides-014208918.html,Reuters
2025-02-13 04:49:00,"JPMorgan, UBS, Nomura Face Korea Short-Selling Fines, Maeil Says",https://finance.yahoo.com/news/jpmorgan-ubs-nomura-face-korea-030711280.html,Bloomberg
2025-02-14 02:51:00,"Telefonica hires JPMorgan to sell its Mexican business, Cinco Dias reports",https://finance.yahoo.com/news/telefonica-hires-jpmorgan-sell-mexican-075120683.html,Reuters
2025-02-14 04:07:00,"Hedge Fund Altana Misused JV Partners Trade Secrets, UK Court Says",https://finance.yahoo.com/news/hedge-fund-altana-misused-jv-090759469.html,Bloomberg
2025-02-17 06:57:00,Lazard Hires JPMorgans Hessberger to Co-Lead Sponsors Group,https://finance.yahoo.com/news/lazard-hires-jpmorgan-hessberger-co-115744597.html,Bloomberg
2025-02-20 19:20:00,"JPMorgan had 'buyer's remorse,' lawyer says as startup founder's trial starts",https://finance.yahoo.com/news/jpmorgan-had-buyers-remorse-lawyer-002011927.html,Reuters
2025-02-24 08:15:00,JPMorgan Earmarks $50 Billion More for Its Direct-Lending Push,https://finance.yahoo.com/news/jpmorgan-earmarks-50-billion-more-131504684.html,Bloomberg
2025-02-24 14:38:00,JPMorgan CEO Jamie Dimon reaffirms DEI commitment despite industry shift,https://finance.yahoo.com/news/jpmorgan-ceo-jamie-dimon-reaffirms-193854018.html,Reuters
2025-02-25 16:40:00,Treasury Yields Slide to 2025 Low as Economic Red Flags Pile Up,https://finance.yahoo.com/news/treasuries-rally-traders-boost-bets-091904370.html,Bloomberg
2025-02-26 02:17:00,Xi Urges Officials to Stay Calm as US Raises Pressure on China,https://finance.yahoo.com/news/xi-urges-officials-stay-calm-033021610.html,Bloomberg
2025-02-26 15:33:00,Oil Dips to New 2025 Low as Market Digests Trump Trade Blitz,https://finance.yahoo.com/news/us-oil-steadies-60s-dour-233311987.html,Bloomberg
2025-02-27 04:46:00,JPMorgans Benhamou Sees US Stocks as Stuck Before Spring Rally,https://finance.yahoo.com/news/jpmorgan-benhamou-sees-us-stocks-094602720.html,Bloomberg
2025-03-02 08:00:00,Jes Staley Shines Spotlight on London Finance Elite Into Epstein Legal Fight,https://finance.yahoo.com/news/jes-staley-shines-spotlight-london-130000704.html,Bloomberg
2025-03-03 04:12:00,Jes Staley Shines Spotlight on London Finance Elite Into Epstein Legal Fight,https://finance.yahoo.com/news/jes-staley-shines-spotlight-london-130000704.html,Bloomberg
2025-03-03 18:05:00,"Nvidia-Backed CoreWeave Files for IPO, Shows Growing Revenue",https://finance.yahoo.com/news/nvidia-backed-coreweave-files-ipo-221314619.html,Bloomberg
2025-03-04 05:21:00,Indian Stocks Post Historic Losing Streak as Global Funds Flee,https://finance.yahoo.com/news/indian-stocks-face-historic-losing-042049605.html,Bloomberg
2025-03-04 18:40:00,Private Credit Looks to Fund $4.5 Billion for Walgreens Buyout,https://finance.yahoo.com/news/private-credit-looks-fund-4-234013647.html,Bloomberg
2025-03-06 17:42:00,JPMorgan Taps William Blairs Kallop for Strategic Investor M&A,https://finance.yahoo.com/news/jpmorgan-taps-william-blair-kallop-224230873.html,Bloomberg
