Date,Title,Link,Source
2024-11-13 11:56:00,Baltimore wins $266 million in opioid case against distributors,https://finance.yahoo.com/news/baltimore-wins-266-million-opioid-165654638.html,Reuters
2024-09-20 09:30:00,Cardinal Health to acquire Integrated Oncology Network for $1.12 billion,https://finance.yahoo.com/news/cardinal-health-acquire-integrated-oncology-133007067.html,Reuters
2024-08-26 08:47:00,McKesson to Buy Stake in Florida Cancer Chain for $2.49 Billion,https://finance.yahoo.com/news/mckesson-buy-stake-florida-cancer-124701603.html,Bloomberg
2024-08-26 08:16:00,McKesson to buy controlling stake in Florida Cancer Specialists' unit for about $2.5 billion,https://finance.yahoo.com/news/mckesson-buy-controlling-stake-florida-121641621.html,Reuters
2024-08-23 15:00:00,McKesson In Talks for Stake in Florida Cancer Specialists,https://finance.yahoo.com/news/mckesson-talks-stake-florida-cancer-190059395.html,Bloomberg
