Date,Title,Link,Source
2024-11-13 14:33:00,Vans Owner VF Cut to Junk as Sales Drop at Firms Top Brands,https://finance.yahoo.com/news/vans-owner-vf-cut-junk-193321705.html,Bloomberg
2024-11-12 02:46:00,Frances Government Softens Plan to Raise Employer Taxes,https://finance.yahoo.com/news/france-government-softens-plan-raise-074604095.html,Bloomberg
2024-11-01 13:11:00,UK Bond Rout Abates as High-Stakes Budget Week Draws to a Close,https://finance.yahoo.com/news/uk-bonds-fall-again-cap-082820040.html,Bloomberg
2024-10-30 16:06:00,"Chicago Mayor Seeks Property Tax Hike, Breaking Campaign Vow",https://finance.yahoo.com/news/chicago-mayor-proposes-property-tax-153018841.html,Bloomberg
2024-10-25 00:35:00,South Korea to Keep Investing in US Whoever Wins Election,https://finance.yahoo.com/news/south-korea-vows-keep-investing-010731263.html,Bloomberg
2024-10-21 05:47:00,Indonesia Leader Taps Jokowi Heavyweights for Economic Team,https://finance.yahoo.com/news/finance-minister-indrawati-reappointed-indonesia-142544616.html,Bloomberg
2024-10-09 02:32:00,Norinchukins Bond Spreads Tighten in Vote of Confidence,https://finance.yahoo.com/news/norinchukin-kicks-off-first-dollar-025650890.html,Bloomberg
2024-10-08 16:23:00,Brazils New Central Bank Head Clears Senate Confirmation Easily,https://finance.yahoo.com/news/brazil-central-bank-head-clears-202313106.html,Bloomberg
2024-10-07 02:34:00,Norinchukin Plans First Dollar Bond Since Signaling Losses,https://finance.yahoo.com/news/norinchukin-bank-plans-first-dollar-023140393.html,Bloomberg
2024-09-25 01:36:00,"Sri Lanka President Dissolves Parliament, Calls Early Poll",https://finance.yahoo.com/news/sri-lanka-president-dissolves-parliament-172059741.html,Bloomberg
2024-08-27 03:01:00,Australia Caps Foreign Students in Bid to Curb Migration,https://finance.yahoo.com/news/australia-caps-foreign-student-intake-014255799.html,Bloomberg
2024-07-20 18:05:00,Ratings Company to Serve Africa Set to Be Ready by Next Year,https://finance.yahoo.com/news/ratings-company-serve-africa-set-220522856.html,Bloomberg
2024-07-17 02:01:00,New Zealand Inflation Slows More Than Expected to 3-Year Low,https://finance.yahoo.com/news/zealand-inflation-slows-more-expected-225143672.html,Bloomberg
2024-11-29 11:31:00,Frances Le Pen Boosts Budget Asks Ahead of Monday Deadline,https://finance.yahoo.com/news/france-le-pen-boosts-budget-075358551.html,Bloomberg
2024-12-04 05:15:00,BOKs Rhee Dismisses Odds of Rate Cut on Yoons Shock Move,https://finance.yahoo.com/news/bok-chief-rhee-says-unlikely-083723363.html,Bloomberg
2024-12-04 13:03:00,"San Francisco Expects $876 Million Budget Gap, Warns of Cuts",https://finance.yahoo.com/news/san-francisco-expects-876-million-015856027.html,Bloomberg
2024-12-05 01:13:00,Koreas Opposition Isolates Yoon With Impeachment Bid,https://finance.yahoo.com/news/south-korea-opposition-party-seeks-031115082.html,Bloomberg
2024-12-15 23:40:00,Pakistans Crackdown on Illegal Dollar Trade Boosts Remittances,https://finance.yahoo.com/news/pakistan-crackdown-illegal-dollar-trade-044000260.html,Bloomberg
2024-12-16 03:29:00,South Korean Court Starts Review of Yoons Impeachment Case,https://finance.yahoo.com/m/490ada6a-0d1c-328b-b150-d6c1eaec0dab/south-korean-court-starts.html,Bloomberg
2025-02-01 07:36:00,India Delivers $12 Billion in Tax Cuts to Spur Economic Growth,https://finance.yahoo.com/news/india-targets-smaller-budget-deficit-063205739.html,Bloomberg
