Date,Title,Link,Source
2024-10-31 08:22:00,"Altria posts better-than-expected Q3 results on robust demand for vapes, nicotine pouches",https://finance.yahoo.com/news/altria-posts-better-expected-q3-122229798.html,Reuters
2024-10-08 06:30:00,"Analysis-Dominating US cigarette sales, a combined 7-Eleven, Circle K would face risk from vapes, cheap smokes",https://finance.yahoo.com/news/analysis-dominating-us-cigarette-sales-103055765.html,Reuters
2025-01-29 17:21:00,Juul wins order banning US imports of Altria vaping devices,https://finance.yahoo.com/news/juul-wins-order-banning-us-222155184.html,Reuters
2025-01-30 08:31:00,Altria 'smoke-free' targets under threat from illicit vapes,https://finance.yahoo.com/news/altria-smoke-free-targets-under-133111342.html,Reuters
2025-01-30 08:38:00,Altria sees weak annual profit as vape competition heats up,https://finance.yahoo.com/news/altria-sees-weak-annual-profit-133817344.html,Reuters
2025-02-24 05:30:00,"Illegal U.S. vape sales worth at least $2.4 billion in 2024, data shows",https://finance.yahoo.com/news/illegal-u-vape-sales-worth-103028510.html,Reuters
