Date,Title,Link,Source
2024-08-29 17:11:00,Chipmaker Marvell Tech beats quarterly revenue estimates amid AI surge,https://finance.yahoo.com/news/chipmaker-marvell-tech-beats-quarterly-211134534.html,Reuters
2024-12-03 13:13:00,"Intel Considers Outsiders for CEO, Including Marvells Head",https://finance.yahoo.com/news/intel-considers-outsiders-ceo-including-181350659.html,Bloomberg
2024-12-03 17:14:00,Marvell forecasts fourth-quarter revenue above estimates on strong AI-backed demand,https://finance.yahoo.com/news/marvell-forecasts-fourth-quarter-revenue-221416119.html,Reuters
2024-12-04 07:11:00,Marvell shares surge as it forecasts strong Q4 amid AI demand,https://finance.yahoo.com/news/marvell-shares-surge-ai-chip-121144431.html,Reuters
2024-12-04 10:46:00,Marvell Soars to Record High After AI Demand Bolsters Outlook,https://finance.yahoo.com/news/marvell-rallies-demand-ai-computing-211823860.html,Bloomberg
2024-12-13 06:24:00,Broadcom hits trillion-dollar valuation on lofty forecasts for AI demand,https://finance.yahoo.com/news/broadcom-rallies-forecast-booming-ai-112453460.html,Reuters
