Date,Title,Link,Source
2024-11-25 09:01:00,"Nvidia shows AI model that can modify voices, generate novel sounds",https://finance.yahoo.com/news/nvidia-shows-ai-model-modify-140131140.html,Reuters
2024-11-25 01:39:00,Chinese vice commerce minister meets with Nvidia senior executive,https://finance.yahoo.com/news/chinese-vice-commerce-minister-meets-063958672.html,Reuters
2024-11-22 22:27:00,Nvidia CEO says global cooperation in tech will continue under Trump administration,https://finance.yahoo.com/news/nvidia-ceo-huang-says-age-032740949.html,Reuters
2024-11-26 09:46:00,"Software is in, chips are out as traders position for Trump era",https://finance.yahoo.com/news/software-chips-traders-position-trump-120125891.html,Bloomberg
2024-11-27 03:27:00,SK Hynix hikes dividend payout to $2.1 billion as AI lead widens,https://finance.yahoo.com/news/sk-hynix-hikes-dividend-payout-082754502.html,Bloomberg
2024-11-29 05:46:00,"TSMC founder Morris Chang offered top job to Jensen Huang, memoir shows",https://ca.finance.yahoo.com/news/tsmc-founder-morris-chang-offered-104606926.html,Reuters
2024-12-05 04:05:00,"TSMC in talks with Nvidia for AI chip production in Arizona, sources say",https://finance.yahoo.com/news/exclusive-tsmc-talks-nvidia-ai-090521536.html,Reuters
2024-12-05 04:05:00,"Exclusive-TSMC in talks with Nvidia for AI chip production in Arizona, sources say",https://finance.yahoo.com/news/exclusive-tsmc-talks-nvidia-ai-090521368.html,Reuters
2024-12-05 06:46:00,"Nvidia to build AI research, data centres in Vietnam with govt",https://finance.yahoo.com/news/nvidia-signs-ai-cooperation-agreement-114600076.html,Reuters
2024-12-05 09:07:00,Italian startup iGenius and Nvidia to build major AI system,https://finance.yahoo.com/news/italian-startup-igenius-nvidia-build-140718448.html,Reuters
2024-12-05 10:00:00,AMD CEO Lisa Su Is Ready for the AI Spotlight,https://finance.yahoo.com/news/amd-ceo-lisa-su-ready-150013139.html,Bloomberg
2024-12-06 07:44:00,"Nvidia's business practices in EU antitrust spotlight, sources say",https://finance.yahoo.com/news/nvidias-business-practices-eu-antitrust-124428802.html,Reuters
2024-12-06 11:16:00,Nvidia-Backed Cohere to Invest in Mega Data Center in Canada,https://finance.yahoo.com/news/nvidia-backed-cohere-invest-mega-161602929.html,Bloomberg
2024-12-07 08:00:00,"As Big Tech Profit Growth Slows, Investors Hunt for a New Thing",https://finance.yahoo.com/news/big-tech-profit-growth-slows-130001741.html,Bloomberg
2024-12-09 06:41:00,China launches anti-monopoly probe into Nvidia,https://finance.yahoo.com/news/china-investigates-nvidia-over-suspected-114158495.html,Reuters
2024-12-09 12:05:00,Nvidia Hit With China Probe in Global Tech War Escalation,https://finance.yahoo.com/news/china-targets-nvidia-potential-breaches-114646991.html,Bloomberg
2024-12-09 15:11:00,China Opens Probe Into Nvidia,https://finance.yahoo.com/video/china-opens-probe-nvidia-201123598.html,Bloomberg
2024-12-10 01:02:00,Baillie cools on tech in favor of boring infrastructure stocks,https://finance.yahoo.com/news/baillie-cools-tech-favor-boring-060229038.html,Bloomberg
2024-12-10 04:49:00,TSMC Revenue Jumps 34% in November in Sign of AI Demand,https://finance.yahoo.com/news/tsmc-posts-34-sales-growth-055123686.html,Bloomberg
2024-12-10 21:35:00,Xi Readies Bargaining Chips for US Trade War After Biden Curbs,https://finance.yahoo.com/m/8cb512a7-eed0-353b-a0d5-750729dc0c38/xi-readies-bargaining-chips.html,Bloomberg
2024-12-11 03:47:00,Xi Readies Bargaining Chips for US Trade War,https://finance.yahoo.com/m/8cb512a7-eed0-353b-a0d5-750729dc0c38/xi-readies-bargaining-chips.html,Bloomberg
2024-12-11 10:08:00,US Supreme Court tosses case involving securities fraud suit against Nvidia,https://finance.yahoo.com/news/us-supreme-court-tosses-case-150813845.html,Reuters
2024-12-11 16:19:00,"Stunning rally in Big Tech drives Nasdaq to 20,000",https://finance.yahoo.com/news/stunning-rally-big-tech-drives-211941413.html,Reuters
2024-12-11 23:06:00,Nvidia steps up hiring in China to focus on AI-driven cars,https://finance.yahoo.com/news/nvidia-steps-hiring-china-focus-040640704.html,Bloomberg
2024-12-11 23:26:00,"Nvidia steps up hiring in China to focus on AI-driven cars, Bloomberg News reports",https://finance.yahoo.com/news/nvidia-steps-hiring-china-focus-042614212.html,Reuters
2024-12-12 06:15:00,Nvidia denies rumours it will cut supplies to China,https://finance.yahoo.com/news/nvidia-denies-rumours-cut-supplies-111538908.html,Reuters
2024-12-12 12:04:00,Crusoe secures $600 million in Series D round led by Founders Fund,https://finance.yahoo.com/news/crusoe-secures-600-million-series-170449260.html,Reuters
2024-12-13 06:24:00,Broadcom rallies on forecast for booming AI chip demand,https://finance.yahoo.com/news/broadcom-rallies-forecast-booming-ai-112453460.html,Reuters
2024-12-13 10:00:00,Worlds Biggest Solo Stock-Picker Is Having Best Year Since 1991,https://finance.yahoo.com/news/world-biggest-solo-stock-picker-150000655.html,Bloomberg
2024-12-13 14:11:00,Fee War Kicks Off for One of Wall Streets Hottest ETF Trades,https://finance.yahoo.com/news/fee-war-kicks-off-one-191104618.html,Bloomberg
2024-12-16 16:01:00,Arm-Qualcomm Contract Fight Threatens to Upend Chip Industry,https://finance.yahoo.com/news/arm-qualcomm-contract-fight-threatens-185118506.html,Bloomberg
2024-12-17 09:54:00,Broadcoms Nvidia Moment Has Arrived. Now It Needs to Deliver,https://finance.yahoo.com/news/broadcom-nvidia-moment-arrived-now-103618972.html,Bloomberg
2024-12-19 09:14:00,"US asks Nvidia, Super Micro to investigate how chips ended up in China, the Information reports",https://finance.yahoo.com/news/us-asks-nvidia-super-micro-141437858.html,Reuters
2024-12-19 16:45:00,Whats Next for Five of 2024s Most Dramatic Tech Stock Stories,https://finance.yahoo.com/news/next-five-2024-most-dramatic-144958297.html,Bloomberg
2024-12-20 05:52:00,EU approves Nvidia's acquisition of Run:ai,https://finance.yahoo.com/news/eu-approves-nvidias-acquisition-run-105200130.html,Reuters
2024-12-23 08:42:00,Apple approaches $4 trillion valuation as investors bet on AI momentum,https://finance.yahoo.com/news/apple-approaches-4-trillion-valuation-134235833.html,Reuters
2024-12-23 20:09:00,"TSMC Shares Touch Record High, Eying Best Year Since 1999 on AI",https://finance.yahoo.com/news/tsmc-shares-touch-record-high-010953890.html,Bloomberg
2024-12-24 02:02:00,"TSMC shares touch record high, eying best year since 1999 on AI",https://finance.yahoo.com/news/tsmc-shares-touch-record-high-010953890.html,Bloomberg
2024-12-24 11:19:00,"Banrion Capital Management's Sissel on Valuations, AI, Trump Admin.",https://finance.yahoo.com/video/banrion-capital-managements-sissel-valuations-161920744.html,Bloomberg
2024-12-26 06:20:00,Wall St set for lower open in holiday-thinned trading,https://finance.yahoo.com/news/futures-lower-holiday-thinned-trading-112012148.html,Reuters
2024-12-29 22:12:00,Nvidia Supplier Ibiden Weighs Faster Expansion for AI Demand,https://finance.yahoo.com/news/nvidia-supplier-ibiden-weighs-faster-230000636.html,Bloomberg
2024-12-30 09:01:00,Nvidia closes $700 million Run:ai acquisition after regulatory hurdles,https://finance.yahoo.com/news/nvidia-closes-700-million-run-140142236.html,Reuters
2024-12-31 06:37:00,"AI boom, Fed rate cuts lift U.S. stocks to new highs in 2024",https://finance.yahoo.com/news/ai-boom-fed-rate-cuts-113757408.html,Reuters
2025-01-02 04:14:00,Nvidia's market value gets $2 trillion boost to more than double in 2024 amid AI rally,https://finance.yahoo.com/news/nvidias-market-value-gets-2-091406933.html,Reuters
2025-01-03 02:00:00,Chipmaker Imaginations Owners Tap Lazard to Search for Buyer,https://finance.yahoo.com/news/chipmaker-imagination-owners-tap-lazard-070000869.html,Bloomberg
2025-01-05 21:39:00,Nvidia-Partner Hon Hais Shares Climb After AI Spurs Sales Beat,https://finance.yahoo.com/news/nvidia-partner-hon-hai-shares-023934619.html,Bloomberg
2025-01-06 16:15:00,Nvidia Investors Look to Huang CES Speech to Spark Next Breakout,https://finance.yahoo.com/news/nvidia-investors-look-huang-ces-105256704.html,Bloomberg
2025-01-06 16:21:00,Risky Stocks Begin New Year Ahead of S&P 500 Amid Concerns,https://finance.yahoo.com/news/risky-stocks-begin-ahead-p-185414032.html,Bloomberg
2025-01-06 17:00:00,Samsung CEO Touts AI Fridges and Washers After Year to Forget,https://finance.yahoo.com/news/samsung-ceo-touts-ai-fridges-220000900.html,Bloomberg
2025-01-06 17:54:00,Samsung Q4 earnings expected to be hit by Nvidia AI chip supply delay,https://finance.yahoo.com/news/samsung-q4-earnings-expected-hit-225445805.html,Reuters
2025-01-06 19:26:00,Nvidia CEO unveils new gaming chips at CES conference,https://finance.yahoo.com/news/nvidia-ceo-set-stage-ces-002616904.html,Reuters
2025-01-06 21:21:00,Asia Chip Shares Surge Ahead of Nvidia CEOs Vegas Appearance,https://finance.yahoo.com/news/asia-chip-shares-surge-ahead-022128068.html,Bloomberg
2025-01-06 22:12:00,Nvidia CEO Unveils More Powerful Graphics Cards at CES Event,https://finance.yahoo.com/news/nvidia-ceo-unveils-more-powerful-031238139.html,Bloomberg
2025-01-07 08:22:00,"Aurora shares jump after deal with Nvidia, Continental to deploy self-driving trucks",https://finance.yahoo.com/news/aurora-shares-jump-deal-nvidia-132255377.html,Reuters
2025-01-07 10:07:00,"Apple Faces Tough January as China Weakness, Tariff Risks Weigh",https://finance.yahoo.com/news/apple-faces-tough-january-china-105307246.html,Bloomberg
2025-01-07 16:04:00,Nvidia CEO says company has plans for desktop chip designed with MediaTek,https://finance.yahoo.com/news/nvidia-ceo-says-mediatek-able-210458721.html,Reuters
2025-01-07 16:20:00,Nvidia Slides After Unveiling Leaves Investors Wanting More,https://finance.yahoo.com/news/nvidia-ceo-unveils-more-powerful-031238139.html,Bloomberg
2025-01-07 16:47:00,Nvidia Traders Bail on Bullish Option Bets as Shares Slide,https://finance.yahoo.com/news/nvidia-traders-bail-bullish-option-174209446.html,Bloomberg
2025-01-07 19:53:00,Quantum Computing Stocks Drop as Nvidia CEO Sees Use Years Away,https://finance.yahoo.com/news/quantum-computing-stocks-drop-nvidia-005300972.html,Bloomberg
2025-01-08 21:57:00,"SK Chief, Nvidias CEO Discuss Ways to Deepen AI Efforts",https://finance.yahoo.com/news/sk-group-chief-meets-nvidia-231222173.html,Bloomberg
2025-01-09 01:41:00,Netherlands secures Nvidia's supply for possible AI-facility,https://finance.yahoo.com/news/netherlands-secures-nvidias-supply-possible-064127191.html,Reuters
2025-01-09 19:58:00,Nvidia AI Chip Partnership Adds Fuel to MediaTeks Share Rally,https://finance.yahoo.com/news/nvidia-partnership-puts-mediatek-stock-005800650.html,Bloomberg
2025-01-09 21:34:00,Nvidia Slams Biden for Trying to Preempt Trump With Policy,https://finance.yahoo.com/news/nvidia-slams-biden-trying-preempt-021048406.html,Bloomberg
2025-01-09 23:35:00,Nvidia criticizes reported Biden plan for AI chip export curbs,https://finance.yahoo.com/news/nvidia-criticizes-reported-biden-plan-043550782.html,Reuters
2025-01-10 10:21:00,TSMC Sales Beat Estimates in Boost for AIs Outlook in 2025,https://finance.yahoo.com/news/tsmc-sales-beat-estimates-boost-053436384.html,Bloomberg
2025-01-13 05:03:00,Nvidia says new rule will weaken US leadership in AI,https://finance.yahoo.com/news/nvidia-says-rule-weaken-us-100341814.html,Reuters
2025-01-13 06:02:00,US tightens its grip on AI chip flows across the globe,https://finance.yahoo.com/m/88a32beb-06d9-306c-afce-5fb193e92524/us-tightens-its-grip-on-ai.html,Reuters
2025-01-13 10:39:00,"Nvidia's biggest customers delaying orders of latest AI racks, The Information reports",https://finance.yahoo.com/news/nvidias-biggest-customers-delaying-orders-153930114.html,Reuters
2025-01-13 16:41:00,White House Unveils New Curbs on Exporting Nvidia AI Chips,https://finance.yahoo.com/m/0b4fb9e0-3ff9-3053-b4f7-ce4d3db0927b/white-house-unveils-new-curbs.html,Bloomberg
