Date,Title,Link,Source
2024-11-22 18:15:00,Feds Bowman Says Regulators Shouldnt Rush to Contain AI,https://finance.yahoo.com/news/fed-bowman-says-regulators-shouldn-231500724.html,Bloomberg
2024-11-21 15:48:00,Charles Schwab Eyes Spot Crypto Trading Once Regulations Change,https://finance.yahoo.com/news/charles-schwab-eyes-spot-crypto-204834225.html,Bloomberg
2024-10-30 00:11:00,US broker Schwab to roll out broader overnight trading platform,https://finance.yahoo.com/news/us-broker-schwab-roll-broader-041108284.html,Reuters
2024-10-15 18:06:00,Asian Stocks to Track US Selloff as Tech Slumps: Markets Wrap,https://finance.yahoo.com/news/asian-stocks-track-us-selloff-220638744.html,Bloomberg
2024-10-15 10:13:00,Schwab Soars on Earnings Beat as Firm Pays Down Costly Debt,https://finance.yahoo.com/news/schwab-soars-earnings-beat-firm-115301602.html,Bloomberg
2024-10-15 09:38:00,Charles Schwab's third-quarter profit jumps on higher asset management fees,https://finance.yahoo.com/news/charles-schwabs-third-quarter-profit-133810699.html,Reuters
2024-12-05 15:22:00,Schwabs Jones Worries Credit Markets Are Priced for Complacency,https://finance.yahoo.com/news/schwab-jones-worries-credit-markets-202205172.html,Bloomberg
2024-12-13 10:38:00,Schwab Raises Its Revenue Growth Guidance as Sweep Cash Flat,https://finance.yahoo.com/news/schwab-raises-revenue-guidance-post-140242217.html,Bloomberg
