Date,Title,Link,Source
2024-11-18 18:36:00,US Raises Import Tariff for Nippon Steel After Review,https://finance.yahoo.com/news/us-raises-import-tariff-nippon-233629153.html,Bloomberg
2024-09-06 12:44:00,US Steel Assets Face Chopping Block Without Japan Deal,https://finance.yahoo.com/news/us-steel-assets-face-chopping-164406636.html,Bloomberg
2024-07-16 12:43:00,"US steelmakers brace for tepid quarterly profit, further price declines",https://finance.yahoo.com/news/us-steelmakers-brace-tepid-quarterly-164358398.html,Reuters
2025-02-11 09:33:00,Trump Steel Tariff Redux Spells Relief But Not Revival,https://finance.yahoo.com/news/trump-steel-tariff-redux-spells-054612464.html,Bloomberg
2025-02-28 12:58:00,Looming Trump Tariffs Make US Steel Too Expensive at Home,https://finance.yahoo.com/news/looming-trump-tariffs-us-steel-175802456.html,Bloomberg
