Date,Title,Link,Source
2024-10-23 06:59:00,Thermo Fisher raises profit forecast on strong demand for its tools and services,https://finance.yahoo.com/news/thermo-fisher-raises-profit-forecast-105946317.html,Reuters
2024-10-09 06:00:00,Dealmaker Paul Parker Joins Health VC Firm Flagship Pioneering,https://finance.yahoo.com/news/dealmaker-paul-parker-joins-health-100000920.html,Bloomberg
2024-10-04 06:07:00,"Exclusive-Thermo Fisher's plant making infant RSV drug breached FDA rules, documents show",https://finance.yahoo.com/news/exclusive-thermo-fishers-plant-making-100719830.html,Reuters
2024-07-24 07:09:00,Thermo Fisher lifts profit forecast as biotech demand shows signs of improvement,https://finance.yahoo.com/news/thermo-fisher-lifts-profit-forecast-110919612.html,Reuters
2025-01-30 06:52:00,Thermo Fisher sees robust 2025 profit on improved demand for its tools and services,https://finance.yahoo.com/news/thermo-fisher-beats-quarterly-estimates-115222189.html,Reuters
2025-02-25 08:56:00,Thermo Fisher buys Solventum's purification and filtration business for $4.1 billion,https://finance.yahoo.com/news/thermo-fisher-buys-solventums-purification-135630177.html,Reuters
