Date,Title,Link,Source
2024-11-19 17:48:00,"T-Mobile Caught Hackers Early, Averting Data Leak",https://finance.yahoo.com/news/t-mobile-caught-hackers-early-220512865.html,Bloomberg
2024-11-14 05:27:00,"Deutsche Telekom Beats on Earnings as US, Germany Demand Grows",https://finance.yahoo.com/news/deutsche-telekom-earnings-boosted-momentum-060001929.html,Bloomberg
2024-10-23 16:43:00,T-Mobile Raises Forecast for Subscribers on Strong Quarter,https://finance.yahoo.com/news/t-mobile-adds-mobile-broadband-201141495.html,Bloomberg
2024-10-22 10:38:00,Verizon Revenue Misses Estimates on Slow Phone Upgrade Cycle,https://finance.yahoo.com/news/verizon-revenue-misses-estimates-slow-120714730.html,Bloomberg
2024-10-18 10:13:00,Verizon to Buy $1 Billion in Spectrum From US Cellular,https://finance.yahoo.com/news/verizon-buy-1-billion-spectrum-141354196.html,Bloomberg
2024-10-17 06:00:00,Cable Companies Have Another Cord-Cutting Problem: Broadband,https://finance.yahoo.com/news/cable-companies-another-cord-cutting-100000418.html,Bloomberg
2024-10-02 16:52:00,T-Mobile Sells $561 Million Wireless Debt Deal Shelved in August,https://finance.yahoo.com/news/t-mobile-sells-561-million-205206232.html,Bloomberg
2024-11-27 09:00:00,T-Mobile Engineers Spotted Hackers Running Commands on Routers,https://finance.yahoo.com/news/t-mobile-engineers-spotted-hackers-140051419.html,Bloomberg
2025-01-13 10:42:00,T-Mobile to acquire Vistar Media for $600 Million to bolster advertising business,https://finance.yahoo.com/news/t-mobile-acquire-vistar-media-154248440.html,Reuters
