Date,Title,Link,Source
2024-11-12 16:33:00,IHeart Bondholder Group Prepares to Challenge Debt Deal,https://finance.yahoo.com/news/iheart-bondholder-group-prepares-challenge-213342744.html,Bloomberg
2024-10-16 07:54:00,U.S. Bancorp Lending Income Beat Estimates in Third Quarter,https://finance.yahoo.com/news/u-bancorp-lending-income-topped-110122393.html,Bloomberg
2024-09-12 08:31:00,U.S. Bancorps Lagging Stock Puts Onus on Investor Day,https://finance.yahoo.com/news/u-bancorp-lagging-stock-puts-101031331.html,Bloomberg
2025-01-16 07:47:00,"U.S. Bancorp, PNC Predict Muted First-Quarter NII on Loan Demand",https://finance.yahoo.com/news/u-bancorp-pnc-predict-muted-124727020.html,Bloomberg
2025-01-28 13:47:00,US Bancorp President Gunjan Kedia to become its first female CEO,https://finance.yahoo.com/news/president-gunjan-kedia-become-us-184701004.html,Reuters
