Date,Title,Link,Source,% Change,hits
2024-10-29 20:03:00,"OpenAI, Broadcom Working to Develop AI Inference Chip",https://finance.yahoo.com/news/openai-broadcom-working-develop-ai-222751131.html,Bloomberg,4.2,
2024-10-29 13:15:00,Broadcom Gains on Report That Its Working With OpenAI,https://finance.yahoo.com/news/broadcom-gains-report-working-openai-171517408.html,Bloomberg,4.2,
2024-10-29 12:42:00,"Exclusive-OpenAI builds first chip with Broadcom and TSMC, scales back foundry ambition",https://finance.yahoo.com/news/exclusive-openai-builds-first-chip-164225286.html,Reuters,4.2,
2024-12-03 11:53:00,Intels CEO Departure Opens Door to Fresh Deal Discussions,https://finance.yahoo.com/news/intel-ceo-departure-opens-door-021652426.html,Bloomberg,0.98,
2024-12-05 09:02:00,Broadcom unveils new tech to speed up custom chips amid rising GenAI demand,https://finance.yahoo.com/news/broadcom-unveils-tech-speed-custom-140241416.html,Reuters,-0.05,
2024-12-06 16:56:00,Apple Plans Three-Year Modem Rollout in Bid to Top Qualcomm,https://finance.yahoo.com/news/apple-prepares-three-modem-rollout-164412669.html,Bloomberg,5.31,
2024-12-11 09:19:00,"Apple working with Broadcom to develop AI chip, the Information reports",https://finance.yahoo.com/news/apple-working-ai-chip-broadcom-141956432.html,Reuters,6.63,3290.0
2024-12-12 14:47:00,"Apple nears switch to in-house Bluetooth and Wi-Fi chip for iPhone, smart home, Bloomberg reports",https://finance.yahoo.com/news/apple-nears-switch-house-bluetooth-194718770.html,Reuters,-1.39,
2024-12-12 16:23:00,Broadcom forecasts first-quarter revenue above estimates,https://ca.finance.yahoo.com/news/broadcom-forecasts-first-quarter-revenue-212324226.html,Reuters,-1.39,
2024-12-12 16:23:00,Broadcom forecasts first-quarter revenue above estimates on strong AI chip demand,https://finance.yahoo.com/news/broadcom-forecasts-first-quarter-revenue-212324609.html,Reuters,-1.39,
2024-12-12 18:31:00,Broadcom Shares Jump After Chipmaker Predicts AI Sales Surge,https://finance.yahoo.com/news/broadcom-shares-jump-chipmaker-predicts-233108061.html,Bloomberg,-1.39,
2024-12-12 19:35:00,Xiaomis 103% Rally Puts EV Dark Horse on Brink of Stock Record,https://finance.yahoo.com/news/xiaomi-103-rally-puts-ev-003521940.html,Bloomberg,-1.39,
2024-12-13 04:35:00,Xiaomis 101% Rally Puts EV Dark Horse on Brink of Stock Record,https://finance.yahoo.com/news/xiaomi-103-rally-puts-ev-003521940.html,Bloomberg,24.43,0.0
2024-12-13 06:00:00,Nasdaq futures lead gains after Broadcom's upbeat forecast,https://finance.yahoo.com/news/nasdaq-futures-lead-gains-broadcoms-110033390.html,Reuters,24.43,8.0
2024-12-13 06:00:00,Nasdaq futures lead advance after Broadcom's upbeat forecast,https://finance.yahoo.com/news/nasdaq-futures-lead-gains-broadcoms-110033548.html,Reuters,24.43,4.0
2024-12-13 06:24:00,Broadcom rallies on forecast for booming AI chip demand,https://finance.yahoo.com/news/broadcom-rallies-forecast-booming-ai-112453460.html,Reuters,24.43,6390.0
2024-12-13 16:23:00,Broadcom Valuation Soars Past $1 Trillion on AI Sales Boom,https://finance.yahoo.com/news/broadcom-shares-jump-chipmaker-predicts-233108061.html,Bloomberg,24.43,48.0
2024-12-17 09:54:00,Broadcoms Nvidia Moment Has Arrived. Now It Needs to Deliver,https://finance.yahoo.com/news/broadcom-nvidia-moment-arrived-now-145444560.html,Bloomberg,-3.91,
2024-12-23 14:08:00,"Tesla, Meta and Broadcom Weights Shrink in Nasdaq 100 Rebalance",https://finance.yahoo.com/news/tesla-meta-broadcom-weights-shrink-190831294.html,Bloomberg,5.52,
